{
  "id": "monarda-fistulosa",
  "scientificName": "Monarda fistulosa",
  "commonName": "Wild Bergamot",
  "zone": "3a-9b",
  "bloomWindow": { "startMonth": 6, "endMonth": 9 },
  "waterNeeds": "medium",
  "sunNeeds": "part-shade",
  "imageRefs": [],
  "placementGuidelines": "Spreads via rhizomes; good for naturalized drifts, watch for powdery mildew in humid sites.",
  "companionPlants": ["echinacea-purpurea"],
  "version": "1.0.0",
  "updated": "2026-07-12"
}
